"ID";"Term_Description";"Fold_Enrichment";"occurrence";"support";"lowest_p";"highest_p";"Up_regulated";"Down_regulated"
"GO:0022626";"cytosolic ribosome";1,21102702702703;10;0,1825;4,77471589477507e-23;3,87795018073314e-15;"RPL8, RPL11, RPL12, RPL17, RPL18, RPL22, RPL24, RPL36A, RPLP1, RPS12, RPS17, RPS19, RPL36, EIF2AK4";"RPL30, RPL31, RPS14, RPS27, RPL23"
"GO:0005741";"mitochondrial outer membrane";1,94558440407621;10;0,345;3,9974543838794e-21;6,05464068032854e-20;"BID, CASP8, CPT1B, ATF2, CYB5A, ACSL1, ACSL3, HADHB, HMOX1, KRAS, RAC2, RAF1, TUFM, VDAC1, ULK1, MFN2, BCL2L11, ABCB6, TOMM40, PGRMC1, PHB2, VPS13A, FIS1, GDAP1, MSTO1, RMDN3, TOMM22, ZNFX1, PINK1, MYO19, QTRT1, HINT2, USP30, BMF, FAM210B, PGAM5, PLD6";"BNIP3, OPA1, KMO, SLC44A1, RAB11FIP5, RHOT1, MFF, MUL1, COASY, RTN4IP1, SLC25A46, LRRK2"
"GO:0090575";"RNA polymerase II transcription regulator complex";1,66516216216216;10;0,1325;1,95972824649397e-20;3,15459698607775e-11;"ATF3, CEBPB, CEBPG, CHD4, CREB1, ATF2, DBP, DDIT3, E2F1, E2F3, E2F6, FOSL2, HIF1A, JUNB, NEUROD1, NFE2L2, NFYB, POU2F1, RARA, STAT3, STAT6, TFDP2, NR1H3, CREB3, BATF, ADNP, HIPK2, BACH2";"GTF2B, RFXAP, THRB, HAND1, ATF6"
"GO:0000502";"proteasome complex";1,46449780012571;10;0,24;6,89310546726507e-20;3,88713700252666e-19;"PSMA5, PSMB6, PSMC4, PSMC6, PSMD12, PSME1, PSME2, VCP, ADRM1";"HSPB1, PSMC1, PSMD7, PSME3"
"GO:0046540";"U4/U6 x U5 tri-snRNP complex";1,96791891891892;10;0,1328391959799;1,64486736221481e-19;1,21903235910714e-06;"SNRPD2, CD2BP2, PPIH, PRPF8, USP39, SNRNP27, SNRNP200, LSM5, LSM4, PRPF31, LSM2, RBM42";"LSM7"
"GO:1990904";"ribonucleoprotein complex";1,4063539668701;10;0,3975;7,26114697162791e-19;1,4573745691161e-12;"BRCA1, DHX9, HNRNPL, NCBP1, NCL, YBX1, NUP98, RPL22, XPO1, ZFP36, SLBP, PABPN1, RBM14, SYNCRIP, AGO1, AKAP8L, AGO2, SRRT, APOBEC3G, RNF135, ZC3H18, MRPL10, JAKMIP1, APOBEC3F";"IGF2BP1, BOP1, ZC3H14"
"GO:0000785";"chromatin";1,33265856249262;10;0,3775;1,24519785149699e-17;2,79351635136427e-16;"RUNX3, ATF2, DFFB, E2F1, EGR1, FANCA, FANCB, FANCG, FER, GATA3, HDAC1, HIF1A, HNRNPL, HSF4, MXD1, PCNA, PPP4C, RARA, RELB, DPF2, RPA2, SP1, STAT3, TAF5, HIRA, NR0B2, BANF1, LDB1, IST1, ZEB2, TOX4, USP3, CHAF1A, NR1H3, KLF2, PRMT5, STAG2, PARK7, KDM1A, CAMTA2, CBX7, L3MBTL1, AKAP8L, UHRF1, TIPIN, ASF1B, NUCKS1, PINK1, KLHDC3";"AR, RUNX2, LOXL2, SMAD4, SNAI2, TCF4, TP63, MAGED1, SETD1A, RAD51AP1, HIF3A, DBF4B, FANK1, CDCA5"
"GO:0071013";"catalytic step 2 spliceosome";0,993663201663202;10;0,2475;1,89584612092669e-17;1,71728343568204e-07;"HNRNPC, HNRNPF, SNRPD2, AQR, SYNCRIP, PRPF8, SF3B2, RALY, SNRNP200, LSM2";"CDC5L, ALYREF, CWC15, PPIL1, GPATCH1, CWC22"
"GO:0022625";"cytosolic large ribosomal subunit";1,28517153888582;10;0,175;3,22478923380077e-17;2,29426986776271e-11;"RPL8, RPL11, RPL12, RPL17, RPL18, RPL22, RPL24, RPL36A, RPLP1, RPL36";"RPL30, RPL31, RPL23"
"GO:0042645";"mitochondrial nucleoid";1,6147027027027;10;0,2525;1,96212992982585e-15;8,03348809685364e-08;"SLC25A5, GRSF1, HSD17B10, HADHA, HADHB, POLRMT, SHMT2, TUFM, VDAC1";"TFAM, LRRC59, DDX28, ELAC2"
"GO:0005635";"nuclear envelope";1,50204902576996;10;0,2775;3,66547458247857e-15;1,3642281062863e-12;"ALOX5AP, EMD, MTOR, GLE1, KPNB1, LMNA, LMNB1, LTC4S, NPC1, NUP88, NUP98, RANBP1, RANGAP1, SREBF1, UBE2I, XPO1, MTMR6, RAB40B, BICD2, FAM156A, RTN4, ROGDI, CALR3, CC2D1B";"BNIP3, GPER1, PLA2G4A, MAPK3, S100A6, MAD1L1, RAE1, NUP93, DHRS2, ATF6, NUP205, NUP160, MYOF, GOLT1A, NUP35, NAPEPLD"
"GO:0016605";"PML body";1,49597456279809;10;0,2775;5,46112918622519e-15;7,29392671372454e-09;"BLM, DAXX, ELF4, MTOR, ISG20, LRCH4, RNF4, RPA1, RPA2, SKI, UBE2I, ZBTB16, ZMYM2, SQSTM1, N4BP1, PARK7, KLHL20, HIPK2";"TRIM16, TOPBP1, TENM2"
"GO:0005788";"endoplasmic reticulum lumen";1,51265829398171;10;0,063913612565445;2,44307346774643e-13;1,79654989604067e-12;"APOA2, C3, C4A, COL10A1, CP, P4HB, PDGFB, CFP, PLAUR, MAPK1, PROC, QSOX1, ADAM17, WFS1, WNT6, APOL1, RNASET2, PROZ, FSTL3, HYOU1, CNPY3, OS9, MGAT4A, ERP44, GANAB, GOLM1, POGLUT1, TXNDC16, ANO8, ACE2, P3H1, VCPIP1, PDGFD, TSPAN14, WNT3A, COL23A1, CALR3, IL27, JMJD8, MIA3";"AHSG, APP, ARSB, COL1A1, COL1A2, COL4A3, COL5A1, COL6A1, COL6A3, COL12A1, COL13A1, COL15A1, COL19A1, CST3, ESD, SERPIND1, TNC, IGFBP3, IGFBP5, IL6, IL12B, KNG1, PENK, MAPK3, RCN1, TF, COL14A1, WNT7B, ENAM, PDIA5, CKAP4, FSTL1, ADAMTS7, BACE1, SUMF2, ADAMTSL4, TMEM132A, PDGFC, ARSJ, COL18A1, EVA1A, APOA5, COL28A1, GPX8"
"GO:0005901";"caveola";1,6147027027027;10;0,14;1,33455648703224e-12;0,000496442472851293;"ATP2B4, F2R, FLOT2, MAPK1, TGFBR2, LRP8, NOS1AP, HDAC6, FLOT1, PACSIN2";"HCK, IRS1, KCNMA1, MAPK3, MYOF, EHD2"
"GO:0042788";"polysomal ribosome";1,97352552552553;10;0,195;1,72898692993704e-12;5,13294419369032e-09;"DHX9, RPL8, RPL11, RPL18, RPL24, RPL36A, LARP4B, RPL36, NUFIP2";"RPL30, RPL31"
"GO:0010494";"cytoplasmic stress granule";1,79700784655623;10;0,268140703517588;2,49517953129518e-12;2,32008001183457e-10;"KPNB1, YBX1, RBM4, STAU1, VCP, ZFP36, EIF3B, G3BP1, CELF1, ATXN2L, HABP4, LARP4B, HIPK2, YTHDF2, OGFOD1, ZNFX1, NUFIP2, ZFAND1, RNF135, LARP4, NANOS3";"IGF2BP1, DHX36"
"GO:0035631";"CD40 receptor complex";3,08261425061425;10;0,135;3,25924984018268e-12;7,01933309158949e-11;"IKBKB, TRAF2, TRAF3, RNF31, DIABLO";"CHUK, TRAF6"
"GO:0005762";"mitochondrial large ribosomal subunit";1,30418295218295;10;0,0425;3,31830824644887e-12;0,000265796691286845;"MRPL28, MRPL18, MRPL4, MRPL35, MRPL16, MRPL40, MRPL38, MRPL34, MPV17L2, MRPL10";"MRPL46, MRPL30, MRPL27, MRPL52"
"GO:0000781";"chromosome, telomeric region";1,41513270573945;10;0,300741206030151;4,88837228858968e-12;7,61162891203338e-10;"BLM, CHD4, ERCC4, ORC1, ORC2, PPP1CC, RPA2, RNF8, MTA2, TOX4, KDM1A, LRIF1, WRNIP1, GATAD2B, ZBTB10, NABP2, PIF1, LRWD1";"BRCA2, RECQL4, RAD50, ALYREF, RTEL1, NLRP2, THOC3, DHX36"
"GO:0071005";"U2-type precatalytic spliceosome";0,968821621621622;10;0,0651633165829146;1,31612677772378e-11;1,67056051157022e-05;"SNRPD2, PRPF8, SF3B2, SNRNP200, LSM5, LSM4, PRPF31, LSM2";"LSM7, CWC22"
"GO:0017053";"transcription repressor complex";1,87832763375621;10;0,1275;1,75929037400719e-11;6,7693372350256e-10;"CTBP1, GATA1, GFI1, RELB, SKI, SP1, TFAP4, ZBTB16, HDAC4, SPEN, RCOR1, GMNN, TBL1XR1, ZFPM1, JAZF1";"CCND1, HOXC9, INSM1, DEPDC1"
"GO:0005874";"microtubule";1,44766449207829;10;0,335;2,26638810098099e-11;2,27270459309352e-10;"CDK5, DNM2, KIF2A, MAPT, MAP3K11, TBCD, TCP1, TUBA1A, HDAC6, CDK2AP2, TUBA1B, TUBB4B, CCT8, RADIL, FSD1, CDK5RAP3, AKNA, TUBB, KIAA0895L";"DLG1, DYNC1H1, DYNC1I2, CLIP1, CCT5, MAP1S, TUBA1C"
"GO:0005689";"U12-type spliceosomal complex";1,41286486486486;10;0,075;3,23020945814944e-11;0,00190257904696999;"YBX1, SNRPD2, SF3B2, SF3B6, SNRNP25, ZCRB1";"SNRNP35"
"GO:0080008";"Cul4-RING E3 ubiquitin ligase complex";1,4742937720329;10;0,04;3,36326532803716e-11;8,24190289207629e-09;"DDB1, DCAF7, DET1, DDA1, DCAF17, DCAF11, DCAF15";""
"GO:0005852";"eukaryotic translation initiation factor 3 complex";2,07604633204633;10;0,07;6,26501617297906e-11;5,87759066778807e-05;"EIF3B, EIF3G, EIF3J, EIF3L";"EIF3H, EIF3I"
"GO:0016363";"nuclear matrix";1,67038210624418;10;0,1975;2,04274569716822e-10;1,03693265976566e-05;"BLM, DGKQ, DNMT3A, ATN1, GFI1, LMNA, MBD1, SMC1A, DCAF7, AKAP8, STAG2, PHB2, SCAF8, KIN, CLIC4, AKAP8L, UHRF1";"RAD21, SPARC, MORC2"
"GO:0031462";"Cul2-RING ubiquitin ligase complex";1,81654054054054;8;0,01;3,29873317962347e-10;0,00276936800594365;"ZER1, GLMN, KLHDC10, FEM1A, FEM1C, KLHDC3";""
"GO:0005694";"chromosome";1,35635027027027;10;0,182964824120603;3,4660386921331e-10;1,53649316634857e-07;"BRCA1, EMX1, NCL, SMC1A, CDYL, MDC1, EMG1, STAG2, POLR1A, GNL3, SETD2, BRIX1, HORMAD1, NIFK, SPATA22, CDCA2, SYCE2, PRR19, SYCE3";"GTF2B, MKI67, RAD21, RAD51AP1, TOPBP1, HSF2BP, BOP1, GET4, CDCA5"
"GO:0005747";"mitochondrial respiratory chain complex I";0,947760282021152;10;0,0475;1,69925202789305e-09;0,000622955892006299;"NDUFA5, NDUFS2, NDUFB11, NDUFA11";"NDUFA8, NDUFB8, NDUFS4, NDUFA13, NDUFS7"
"GO:0035861";"site of double-strand break";1,29752895752896;10;0,1825;3,6039404371183e-09;3,13153697531621e-05;"ATF2, LMNA, RPA2, VCP, WAS, RNF8, PARP3, ZBTB7A, INTS3, NABP2, RNF168, APLF";"RAD50, KDM4D, RAD18"
"GO:0005643";"nuclear pore";1,06334080421885;10;0,0975;3,93565083649205e-09;5,45242279589363e-07;"KPNB1, NUP88, NUP98, BICD2";"AGFG1, RAE1, NUP93, NUP205, NUP160"
"GO:0016442";"RISC complex";1,93764324324324;10;0,105;5,40741557783931e-09;1,59701581905197e-06;"DHX9, AGO1, AGO2, AGO3";"TNRC6A, MIR31"
"GO:0000775";"chromosome, centromeric region";1,87513862249346;10;0,17;7,91257226205179e-09;1,16706788571985e-07;"CENPA, DAXX, PPP2R1A, PPP2R5C, SMC1A, CTCF, STAG2, C9orf78";"RAD21, NDC80, ZNF330, CDCA5"
"GO:0016323";"basolateral plasma membrane";1,28943884892086;10;0,1;8,70215202642577e-09;9,81105928905238e-06;"ATP1B3, ATP2B1, CD81, CTNNB1, EPB41, FLOT2, B4GALT1, KCNJ4, LRP1, PDGFB, SLC2A1, SLC7A1, EZR, SLC30A1, SLC7A5, SLC16A3, SLC23A2, FLOT1, SLC43A3, SLC40A1, NOD2, SLC26A6, SLC38A1, SLC43A2, SLC29A4";"ANK3, DLG1, FOLR1, IDE, BSND, ABCB11, CLDN1, ABCC4, SLC4A10, SLC4A5, NKD2, CALHM3"
"GO:0071007";"U2-type catalytic step 2 spliceosome";1,13029189189189;10;0,087713567839196;1,15656460652135e-08;0,000823580836980452;"SNRPD2, AQR, PRPF8";"CDC5L, CWC15, PPIL1, CWC22"
"GO:0031463";"Cul3-RING ubiquitin ligase complex";1,70968521462639;10;0,02;1,17484433335572e-08;0,012117551779175;"TNFAIP1, SPOP, ENC1, KEAP1, KLHL21, GLMN, ZSWIM8, KLHL20, KLHL25";"KLHL41, KLHL40, KCTD13"
"GO:0036464";"cytoplasmic ribonucleoprotein granule";1,48014414414414;10;0,298253768844221;1,34072420367068e-08;2,19380235277425e-07;"BARD1, CDC42, DHX9, MAPT, NCL, STAU1, TUBA1A, USP3, UPF2, AGO1, AGO2, SLC39A2, YTHDF2, BTBD1, NFKBIZ, ZC3H12A, SARNP, AGO3, TUBB";"GHR, MCC, MAP1LC3C"
"GO:0000307";"cyclin-dependent protein kinase holoenzyme complex";2,42205405405405;10;0,105;1,55770074847291e-08;2,14588808699135e-08;"CCNC, CDK2, CDK5, CDKN1A, CDK16, CCNL2";"CCND1, CDK6, CDK14"
"GO:0034774";"secretory granule lumen";1,24317818703659;10;0,215;1,58053279105631e-08;2,59996908885874e-06;"A1BG, ALDOA, ALDOC, C3, MAPK14, CSNK2B, CFD, FGR, GSTP1, MIF, NFKB1, PKM, PSMA5, PSMD12, S100P, SRP14, VCP, PDXK, GMFG, HUWE1, CCT8, OSTF1, DBNL, CAB39";"AHSG, DEFA5, PSMD7, TF, ATG7"
"GO:0005681";"spliceosomal complex";0,775057297297297;10;0,08;2,10236445911425e-08;0,00140251627937756;"HNRNPC, SNRPD2, SF1, SF3B2, SNRNP200";"CDC5L, CWC15, CWC22"
"GO:1904813";"ficolin-1-rich granule lumen";1,25009241499564;10;0,2325;2,23162849248503e-08;5,32052584079158e-06;"A1BG, ALDOA, ALDOC, MAPK14, CSNK2B, CTSD, CFD, GSTP1, KPNB1, MIF, PKM, MAPK1, PSMA5, PSMD12, SRP14, VCP, CDK13, GMFG, HUWE1, CCT8, QPCT, OSTF1, DBNL, YPEL5, CAB39, KCMF1, GSDMD, PLEKHO2";"ARSB, CST3, PSMD7, ATG7"
"GO:0000932";"P-body";1,29752895752896;10;0,0651633165829146;2,26299791281636e-08;2,09674124241331e-06;"CNOT3, ZFP36, SQSTM1, AGO2, YTHDF2, BTBD1, APOBEC3G, ZC3H12A, MEX3B, APOBEC3D, APOBEC3H, APOBEC3F, NANOS3";"IGF2BP1, TNRC6A"
"GO:0000118";"histone deacetylase complex";1,8631185031185;10;0,223040201005025;2,58408456491105e-08;5,58450772395827e-08;"HDAC1, MTA2, HDAC4, HDAC6, SIN3A, PHF21A, TBL1XR1, ZNF541";"HDAC9, SAP18"
"GO:0005778";"peroxisomal membrane";1,4742937720329;10;0,02;2,89778815398461e-08;5,4022590468293e-08;"ABCD1, PEX1, PEX6, PEX10, PXMP2, PEX3, PEX16, DECR2, FIS1, GDAP1, PEX26, USP30";"ABCD2, MPV17"
"GO:0005764";"lysosome";1,15455426410867;10;0,0255890052356021;5,63973958093045e-08;0,00168262482726349;"CTSD, MTOR, GBA, GRN, HYAL1, NPC1, PIP4K2A, LGMN, RAB27A, UVRAG, CXCR4, USP5, HYAL3, RNASET2, BCL10, RAB9A, TMEM59, PLEKHM1, NPC2, AP3M1, BBC3, VPS4A, TMEM97, ARL8B, RRAGC, VPS16, CHID1, ITM2C, RILP, RFFL, DTX3L, SLC38A9, LAMTOR4";"ARSB, GAA, HCK, HPS1, LAMP1, CALCRL, RAMP3, BACE1, VPS41, LAPTM4B, UNC93B1, LRRK2, RAB7B"
"GO:0005667";"transcription regulator complex";1,19607607607608;10;0,1075;9,55138033330402e-08;6,64546170193345e-06;"CTNNB1, GATA1, RARA, SKI, STAT3, LDB1, MTA2, RBM14, PMF1, KDM1A, HES6, ZFPM1";"ZFHX3, HOXA11, SMAD4, TCF4, MED27, HDAC9, NAA16, SCX"
"GO:0016581";"NuRD complex";2,01837837837838;10;0,155;9,76907295806399e-08;6,89504377367398e-06;"CHD4, HDAC1, MTA2, CHD5, GATAD2A";""
"GO:0005925";"focal adhesion";1,19295199677289;10;0,1425;1,17405458689414e-07;0,000161138690503751;"CFL1, PTK2B, ITGA5, ITGAV, MYH9, PLEC, MAPK1, MAP2K1, RSU1, SRP68, ADAM17, TLN1, VASP, EZR, MDC1, MTF2, REXO2, GIT1, EVL";"HCK, ITGA1, ITGB6, MAPK3, RDX, NRP1, CORO2B, FERMT2, LIMS2, ENAH, CASS4, TRPV4, TNS4, SYNPO2"
"GO:0031965";"nuclear membrane";1,21102702702703;10;0,1275;1,85563600712362e-07;3,10382795654572e-07;"ALOX5AP, DUSP2, EMD, GCHFR, GLE1, GRK5, NR4A1, INPP4A, KPNB1, LMNB1, LTC4S, NUP98, RANGAP1, SPAST, XPO1, SLC30A1, CPNE1, SLC16A3, MAD2L1BP, NOS1AP, ZBTB1, HABP4, TMEM97, MRPS23, RETSAT, RNF123, AEN, TMEM53, EPC1, TNRC18, TMEM18, CREB3L4";"CDH5, HOXA7, MYO6, NRXN1, NUP93, SCRN1, NUP205, NUP35"
"GO:0010008";"endosome membrane";1,16617417417417;10;0,0525;1,86176498986416e-07;0,000502499408405789;"CLCN3, CTSD, ECE1, IRAK2, IRF7, MYD88, SORL1, UBA1, AP3D1, TAB1, RAB35, VPS45, TAB2, VPS13A, ACAP2, VPS4A, VPS28, WIPI1, PMEPA1, TMBIM1, VPS16, VPS33A, RFFL";"CLCN4, LAMP1, TF, TLR3, TLR4, TRAF6, RNF144A, DNAJC13, BACE1, VPS41, EHD3, EHD2, VPS37C, VAC14, SPPL2B, RHOU"
"GO:0000776";"kinetochore";1,11414486486486;10;0,125;2,19091923204063e-07;1,8617279160328e-05;"BUB1, KIF22, NUP98, RANGAP1, XPO1, SMC1A, BUB3, DCTN2, SPAG5, SUGT1, PMF1, MEAF6, MIS12, NDEL1, ZNF276, LRWD1, SKA2";"CLIP1, MAD1L1, AURKB, NDC80, NUP160, CHAMP1"
"GO:0005769";"early endosome";1,46791154791155;10;0,15;2,47538157989114e-07;8,29424858096623e-05;"APOA2, CLCN3, F2R, RAPGEF1, HTT, LRP1, NF2, MAPK1, MAP2K1, SORL1, UVRAG, VCAM1, CXCR4, PICALM, HYAL3, USP8, FLOT1, INPP5F, TBC1D2B, MGRN1, RUSC1, LAMP3, VPS4A, RABGEF1, TMEM230, VPS28, VPS16, VPS33A, RIN3, ANKRD13B, PPP1R21, DTX3L";"APP, GPER1, MME, MAPK3, TF, CLTCL1, NRP1, TGFBRAP1, TM9SF4, BACE1, CNTNAP2, RAB11FIP5, LAPTM4B, KIF16B, ALS2, NAPEPLD, STEAP2, SNX30"
"GO:0032993";"protein-DNA complex";1,34558558558559;10;0,085;3,37326034270981e-07;7,09268264944493e-06;"CTNNB1, DDIT3, GATA1, NFE2L2, NFYB, SP1, ZBTB17";"GTF2B, HOXA11, HMGA2"
"GO:0015630";"microtubule cytoskeleton";1,20218741369106;10;0,21;3,52782660339771e-07;5,59179012585634e-06;"LYST, FER, MAPT, CDK16, SHMT2, SPAST, SPTAN1, TUBA1A, OFD1, CCNB2, ACTR1A, SPRY2, TUBA1B, TUBB4B, CEP131, RUSC1, CLIC4, WDR11, TUBB1, FAM83D, TUBB, EML3";"GTF2F2, HOXC8, CLIP1, AURKB, EHD2, ADCY10, TEX35, ARL6, TUBA1C, IFT43, KANK4, TUBB8"
"GO:0140672";"ATAC complex";2,42205405405405;10;0,02;4,22054640618552e-07;0,000116899744130509;"KAT2A, TADA2A, ZZZ3";"MBIP, YEATS2, POLE4"
"GO:0009898";"cytoplasmic side of plasma membrane";1,35635027027027;10;0,0971204188481676;4,28657137641506e-07;1,55956365473979e-06;"IKBKB, MYH9, RGS2, TRAF2, TRAF3, LITAF, RASA3, RNF31, DIABLO";"ACP1, CACNB4, CHUK, DLG1, TRAF6"
"GO:0000151";"ubiquitin ligase complex";1,6147027027027;10;0,1;5,69306857872421e-07;8,06913349528646e-06;"MKLN1, TRAF2, UBE2L3, RNF8, STUB1, SUGT1, UBE2C, YPEL5, RANBP10, RMND5A, BRCC3, TRAF7, UBE2J2, RNF168";"UBE2D1, ARMC8, ASB1"
"GO:0031982";"vesicle";1,80846702702703;10;0,1125;6,75075716022512e-07;0,00111416855155154;"BIN1, CD81, ECE1, FLOT2, PRKCZ, PICALM, VTI1B, DCTN2, LAMP3, LGR6, NOD2, SLC26A6, RIN3, RAB39B, SLC30A7";"BMP5, DYNC1I2, KCNN4, RAB4A, TF, RIPK2, GPRC5A, NRXN1, KCNE3, TSPAN1, ALS2, LZTS2, SLC24A4"
"GO:0015629";"actin cytoskeleton";1,0341354388096;10;0,07;7,46868320331414e-07;8,49788585333406e-05;"ALDOA, BIN1, DHX9, FER, FGR, FLNA, FOXA3, HNRNPC, LSP1, MYH9, MYO9B, RARA, ADAM17, TAF5, VASP, EZR, WAS, SLC9A3R1, SPRY2, EFR3B, CLIC4, KLHL20, CLIC5, KANSL2, PDXP, ABLIM2";"ATP12A, CAPZA2, GBP1, MSRA, DDR2, TOPBP1, SYNPO, FMN2, SPPL2B, MPP4, ARSJ, SYNPO2"
"GO:0030496";"midbody";1,43529129129129;10;0,125;9,35620062469338e-07;0,000870347950301456;"CDC42, GNAI2, RAB8A, PIN1, PKN1, SLC2A1, SPAST, UVRAG, SSNA1, USP8, CTDP1, KIF20B, IST1, URB2, KEAP1, KIF20A, NUDC, KATNA1, CPEB3, CLIC4, GNL3, VPS4A, YPEL5, ALKBH4, ARL8B, PDXP, WIZ, RAB11FIP4, ZFYVE19, ANKRD54, HEPACAM2, EML3, ANKRD45";"DEFA5, RAD21, AURKB, TTC28, ZNF330, RACGAP1, MITD1"
"GO:0070847";"core mediator complex";1,1178711018711;10;0,015;1,12421234978345e-06;1,48287625357529e-06;"MED14, MED26, MED29";"MED27, MED28, MED11"
"GO:0005665";"RNA polymerase II, core complex";1,4904948024948;10;0,0256518193059539;1,12421234978345e-06;1,48287625357529e-06;"POLR2E, POLR2G, POLR2I, POLR2J";""
"GO:0055038";"recycling endosome membrane";1,50882055826318;10;0,0637958115183246;1,2083889979996e-06;0,000259015441074596;"RAB8A, RAP2A, BAIAP3, RAB11B, VAMP3, SCAMP2, OPTN, VTI1B, RAB35, PACSIN2, CLIP3, EHD4, RAP2C, ATG9A, RAB11FIP4";"GRIA1, ABCB11, EHD3, EHD2"
"GO:0045121";"membrane raft";1,25870525643754;10;0,1875;1,56302592118351e-06;9,92014405839432e-06;"ATP2B4, BTK, CD79A, CTSD, CD55, FYN, LCK, LYN, MAPT, MYO1C, PGK1, RAP1B, SLC1A2, ADAM17, TGFBR1, TGFBR2, TNFRSF1B, ZAP70, TNFRSF10A, FLOT1, CLIP3, PI4K2A, ACE2, MYADM";"ADCY2, APP, LDHB, MME, TLR1, KCNE3, ERLIN2, LAT, GP6"
"GO:0030054";"cell junction";1,34384934612031;10;0,055;1,59355290542093e-06;0,0020024151828599;"AGER, CDK5, CTNNB1, DLG4, EPB41, FER, GTF2A2, P2RX4, PRKCZ, CLDN9, NAMPT, ABCA7, NCAPH2, COPS4, PAF1, CGN, SLC2A11, NACC1, CCDC88C";"CDH5, DLG1, DPEP1, DTNA, HOXC5, HOXD4, ITGB6, CLDN11, PTPRK, RAB13, RAD51C, TSPAN1, YAP1, FERMT2, SAMD4A, ARHGEF18, MRPL46, RAB23, MAP1S, TBC1D2, ENAH, TENM2, PLEKHA7, GPR142"
"GO:0019005";"SCF ubiquitin ligase complex";0,835191053122088;10;0,02;1,63983979299967e-06;0,0150461584729838;"SKP1";"FBXO2, FBXL5, FBXO44, FBXO32"
"GO:0070062";"extracellular exosome";1,15927373527374;10;0,035;1,76509651810553e-06;0,000205698241815403;"ALDOA, FASLG, CD81, ICAM1, YBX1, QSOX1, RAB5B, PMEL, WNT6, PROM1, ABCB6, AGO2, WNT3A, MIRLET7A1, MIRLET7F1, MIR22, MIR27A, MIR9-1";"ANXA1, CD9, IDE, SERPINA5, PKHD1, RAB4A, SLC12A1, WNT7B, MIRLET7B, MIR10B"
"GO:0031410";"cytoplasmic vesicle";1,31788235294118;10;0,0409424083769633;2,01568205290682e-06;0,000836223825242084;"ARHGDIG, CLCN3, FLOT2, HYAL1, PDE6D, SPAST, TESK1, CXCR4, AXIN1, HYAL3, FLOT1, ATP8A1, BICD2, RUSC1, SLC39A2, PI4K2A, WDR11, TBC1D23, RIN3, ANP32E, AZIN2";"ABCA4, DVL1, HPS1, MME, MMP14, MYO6, RAB13, SLC1A3, TF, NRP1, USP6NL, MYOF, TBC1D2, NKD2, LRRK2, CMTM3"
"GO:0005811";"lipid droplet";1,29631062047963;10;0,1125;2,10580826844873e-06;3,70401555872358e-05;"ACSL3, HSD11B2, LSS, RAP1B, SET, VCP, OSBPL2, BCAP31, RAB3GAP1, VPS13A, NSDHL, ZFYVE1, RAB40C, LPCAT1, C18orf32";"CLDN11, TRAF6, CKAP4, METTL7A"
"GO:0000792";"heterochromatin";1,55011459459459;10;0,0225502512562814;2,45487393623413e-06;0,00401684747069015;"ORC2, SUV39H1, UBA1, ZBTB18, CHD5, UHRF1";"MORC2, BEND3"
"GO:0022624";"proteasome accessory complex";1,13979014308426;10;0,105;2,77403411778353e-06;3,83665065773476e-06;"PSMC4, PSMC6, PSMD12";"PSMC1"
"GO:0005793";"endoplasmic reticulum-Golgi intermediate compartment";1,58174958632101;10;0,055;2,8288387745532e-06;0,00353657351143019;"CLN8, P4HB, GBF1, PROM1, SEC22B, IST1, YIF1A, LMAN2, TMED1, ERP44, CNIH4, TMED5, TMED9, RAB37";"SLC35C2, RGMB"
"GO:0005938";"cell cortex";1,16926747437092;10;0,0825;2,86046398433028e-06;2,90322913988626e-05;"AKT2, CTNNB1, EPB41, MKLN1, MYO9B, NCL, AKAP13, DBNL, SPIRE2";"EPS8, MYO6, MELK, COBL, FMN2"
"GO:0005777";"peroxisome";1,44766449207829;10;0,015;3,58123207583449e-06;6,56863812904406e-06;"ACAA1, ACOX1, ABCD1, CRAT, MVD, PEX1, PEX6, PEX10, PHYH, ACOX3, PEX3, PEX16, MGAT4A, HACL1, FIS1, PEX26, LACC1, GSTK1";"ABCD2, IDE, MPV17, NOS2, MFF, MUL1, KCNIP4, NUDT7"
"GO:0035579";"specific granule membrane";1,5239890677194;10;0,035;3,59259613891852e-06;0,00147116745612133;"BST1, CYBA, ITGAM, ITGAV, LAIR1, PLAUR, PLD1, PTPRB, PTPRJ, VAMP1, TNFRSF1B, MLEC, ATP8A1, PGRMC1, TMBIM1, DNAJC5, TSPAN14, HVCN1, SLC15A4, MOSPD2, RAB37, SLCO4C1";"FPR2, OLR1, AP1M1, CKAP4, CD93, MMP25"
"GO:0005765";"lysosomal membrane";1,12208153916629;10;0,0300753768844221;3,59259613891852e-06;0,0316092040070946;"AP1B1, ABCD1, ANXA6, CLCN3, CTSD, MTOR, GBA, GRN, LYN, NPC1, GPR137B, UBA1, TFEB, LITAF, AP1M2, ABCB6, VTI1B, KPTN, VPS13A, TM6SF1, ARL8B, LMBRD1, TMBIM1, RILP, WDR24, SLC15A4, SLC38A9, CYB561A3, GPR137C, LAMTOR4";"CLCN4, HLA-DQB1, HLA-DRB1, LAMP1, MYO6, AP1M1, SPAG9, VPS41, SLC38A7, LAPTM4B, SPPL2B"
"GO:1990907";"beta-catenin-TCF complex";2,90646486486486;10;0,0676758793969849;3,89695366069528e-06;5,5347005606785e-06;"CTNNB1, LDB1, PYGO2, BCL9L";"TCF4, TLE1"
"GO:0005912";"adherens junction";1,25009241499564;10;0,09;5,12604617688786e-06;1,62223148676335e-05;"CTNNB1, FLOT2, SMAD7, NOTCH1, TLN1, CYTH3, FLOT1, SH3BP1, CDCA3, CCDC85C";"CDH5, FAT2, MYO1E, FERMT2, MPP4, TRPV4"
"GO:0016328";"lateral plasma membrane";1,8329057706355;10;0,1725;5,22591912794789e-06;5,89361988781059e-05;"CTNNB1, MARK2, MYO1C, PPP2R1A, TBCD, AXIN1, SLC16A3";"ANK3, ANXA1, DVL1, TACSTD2, PTPRO, RAB13, NKD2"
"GO:0005770";"late endosome";1,58174958632101;10;0,0775;5,50222198724153e-06;0,00132125971322134;"CLCN3, F2R, GRN, HTT, MAPK1, MAP2K1, LGMN, RAB27A, UVRAG, CXCR4, RAB9A, TMEM59, VAMP5, VPS4A, TMEM230, SDF4, VPS16, VPS33A, CHID1, ATG9A, RILP, ANKRD13B, SLC38A9";"LAMP1, MAPK3, TF, CLTCL1, RAPGEF2, BACE1, VPS41, KIDINS220, RAB7B"
"GO:0016234";"inclusion body";1,6147027027027;10;0,2225;6,11402554822911e-06;5,34958137735442e-05;"HTT, SQSTM1, KEAP1, HDAC6";"LRRK2"
"GO:0031464";"Cul4A-RING E3 ubiquitin ligase complex";1,32112039312039;10;0,02;6,93697927811552e-06;0,000431140118967178;"DDB1, GLMN, DET1";""
"GO:0005758";"mitochondrial intermembrane space";0,871939459459459;10;0,0205214554447631;7,40804129655605e-06;0,0104191498109962;"AK2, NME4, REXO2, DIABLO, PINK1, PANK2, CLPB";"NDUFA8, OPA1"
"GO:0008250";"oligosaccharyltransferase complex";1,8631185031185;10;0,0975;8,45017518477138e-06;0,000100490520608831;"DDOST, STT3A, MLEC, STT3B";"KRTCAP2"
"GO:0001772";"immunological synapse";1,66516216216216;10;0,08;9,0078804836586e-06;0,000375734527513297;"ATP2B1, CD37, CD81, LCK, MYH9, PTPRJ, EZR";"ALCAM, DLG1, HLA-DRB1, LAT"
"GO:0072686";"mitotic spindle";1,27219000819001;10;0,135;1,06111717940945e-05;0,000617630082728854;"CDC6, CDC42, EPB41, GOLGA2, KIF22, LIMK2, MAPK1, TFDP2, TUBB4B, TACC3, SPAG5, NUDC, EML2, TBL1XR1, TUBB1, FAM83D, TUBB, HEPACAM2";"DIAPH1, PKHD1, MAD1L1, RACGAP1, HECW2, EFHC1, RMDN2, TUBB8"
"GO:0005814";"centriole";1,14860295346893;10;0,0325;1,06558465352041e-05;0,000253252937097719;"CETN2, GLE1, HTT, KIF2A, ALMS1, OFD1, SSNA1, CEP104, CCP110, MPHOSPH9, CCHCR1, CEP192, MDM1, STARD9, TSKS, ARMC9, CCDC92, AKNA, CEP19, FBF1, CEP120";"CEP135, CNTLN"
"GO:0005902";"microvillus";1,70968521462639;10;0,105;1,08555780920848e-05;0,000958097682271637;"MYO1C, SPN, TGFB1, VCAM1, EZR, SLC9A3R1, CLIC4, ESPN";"MYO7B, RDX, JAM3, LRRK2"
"GO:0016514";"SWI/SNF complex";1,21102702702703;10;0,0075;1,18043500508155e-05;0,0311848993546624;"SMARCB1, NCR1, BCL11B, ARID2";"BCL11A, BRD9"
"GO:0044297";"cell body";2,26058378378378;10;0,195489949748744;1,20465897416443e-05;7,02373856406527e-05;"PTK2B, FYN, KCNJ10, MAPT, P2RX4, SLC1A2, STAU1, PITPNM1, PGRMC1, PINK1, TUBB";"ACTA2, FCGR2B, RNF157"
"GO:0008180";"COP9 signalosome";1,38403088803089;10;0,065;1,29549477543976e-05;1,64201227187863e-05;"COPS7A, COPS4, COPS7B";"LAT"
"GO:0001650";"fibrillar center";1,29878260869565;10;0,06;1,55101065852872e-05;0,00442328162396859;"AGER, EEF1D, HOXB5, SMAD7, SMARCB1, SNAI1, TCOF1, TXNRD1, UBTF, EZR, KDM4A, IP6K1, DDX46, CD2BP2, TIMM44, DEAF1, RPP38, STAG2, AKNA, MRI1, RPAIN, BTBD10, MBD6, JAZF1, ZNRF2";"PTPN13, TAF4B, KDM5D, DUSP11, RAE1, RNMT, TAF1C, POLR1C, UBD, SAMD4A, TRERF1, RERG"
"GO:0030425";"dendrite";1,52971834992888;10;0,11;1,56606017360746e-05;0,00119166658775277;"BIN1, C4A, CDK5, MARK2, PTK2B, FYN, GCHFR, HTT, INPP5A, KCNB1, MAPT, RAB27A, STAU1, WFS1, CRIPT, SLC4A8, HDAC6, CYP46A1, CPEB3, PI4K2A, RIN3, TMEM222, AZIN2, CNIH2";"ADCY2, ANK3, BNIP3, CHRNA3, DSCAM, GPER1, GRIA1, MME, OPA1, ARHGAP44, KCNE3, NLGN1, COBL, MAP1S, SLC4A10, TENM2, DIP2B, ALS2, MAGEE1, MLPH, ATCAY, LRRK2, SLC32A1, DHX36"
"GO:0034709";"methylosome";1,21102702702703;10;0,0925;1,71238573572526e-05;0,00404770865557394;"PRMT1, SNRPD2, PRMT5";""
"GO:0030027";"lamellipodium";1,03506583506584;10;0,07;1,81272238140497e-05;0,000164149143315681;"CFL1, PTK2B, FER, FLOT2, P4HB, RAC2, DGKZ, FLOT1, KPTN, SH3BP1, DBNL, EVL, PDXP, SPATA13";"ACTA2, DPP4, PTPN13, PTPRO, RAB13, RDX, CDC42BPA, UNC5C, ABLIM3, ALS2, TRPV4"
"GO:0005856";"cytoskeleton";1,01094430082256;10;0,1275;1,96873910160309e-05;7,01040010315825e-05;"BIN1, CASP8, CR1, DGKQ, FGR, ITPKB, LLGL1, NF2, P4HB, MAPK1, UXT, LRRFIP1, SPRY2, TUBB4B, NOD2, PINK1, ZC3H12A, TUBB";"HSPB1, MYO1E, MAPK3, RIPK2, KLHL41, LDB3"
"GO:0101031";"chaperone complex";1,21102702702703;10;0,12;2,01174611960064e-05;0,00330412613399376;"STUB1, STIP1, SDF2L1";"PPP5C, BAG3, PIH1D2"
"GO:0045171";"intercellular bridge";1,12241529334212;10;0,0626507537688442;2,27092160965591e-05;0,00904728587524081;"CDC6, EPB41, QSOX1, KIF20B, PARP3, KIF20A, TUBB4B, RAB35, CEP131, NCAPH2, RMDN3, SNRNP25, USB1, TUBB1, FAM83D, TUBB";"DUSP11, EHD2, TUBB8"
"GO:0072546";"EMC complex";1,45323243243243;10;0,015;2,37873913785743e-05;0,0095449544191822;"EMC8, EMC9";"EMC4"
"GO:0005768";"endosome";1,16258594594595;10;0,105;2,52770629854947e-05;0,000891238579717786;"CDK2, DGKQ, ECE1, FLOT2, FYN, GRN, IL2RB, IL15RA, JAK1, JAK3, PI4KB, PLD1, PKN1, RAB5B, SORL1, SPAST, TGFBR1, TNFAIP1, EZR, ABCG1, ABCB6, FLOT1, VPS4A, VPS28, LEPROT, PI4K2A, ATG9A, SYT3, RAB11FIP4";"ANXA1, APP, CTSE, ABCB11, BECN1, CALCRL, RAB11FIP2, BACE1, LAPTM4B, KIF16B, UNC93B1, LRRK2, CLEC18C"
"GO:0035770";"ribonucleoprotein granule";2,20186732186732;10;0,07;2,69805168986624e-05;0,000463089781913308;"GRSF1, HNRNPL";"TDRD7, TRUB2, DDX28"
"GO:0031519";"PcG protein complex";0,922687258687259;10;0,005;3,30641957987298e-05;0,0479551726642154;"SKP1, CBX7, PCGF5, KDM2B";""
